{
  "$schema": "https://json-schema.org/draft/2020-12/schema",
  "$id": "https://ubm-hyogo.invalid/schema/cloudflare-alerts/quota-base.schema.json",
  "title": "CloudflareQuotaBase",
  "type": "object",
  "required": ["version", "source", "values"],
  "properties": {
    "$schema": { "type": "string" },
    "version": { "type": "integer", "minimum": 1 },
    "source": { "type": "string" },
    "snapshotAt": { "type": "string" },
    "values": {
      "type": "object",
      "additionalProperties": { "type": "number", "exclusiveMinimum": 0 }
    }
  },
  "additionalProperties": false
}
